{
  "schema_version": "0.1.0",
  "protocol_version": "0.1.0",
  "hypothesis_id": "hypothesis-writing-golden-task-response",
  "claim": "The learner explains the access benefit but omits the requested implementation challenge and repeats the benefit instead.",
  "skill_refs": [
    "writing.task-response"
  ],
  "confidence": 0.94,
  "supporting_evidence": [
    "artifact-writing-golden-draft"
  ],
  "contradicting_evidence": [],
  "created_at": "2026-08-26T16:05:00Z",
  "last_updated_at": "2026-08-26T16:05:00Z",
  "status": "provisionally_supported",
  "next_test": "Require a rewrite and then a changed-material transfer that each address one benefit and one implementation challenge.",
  "producer": "External Codex Coach",
  "producer_version": "manual-smoke-1"
}
