{"schema_version":"0.1.0","protocol_version":"0.1.0","hypothesis_id":"hyp-tfng-031","claim":"The learner may confuse absent support with semantic contradiction.","skill_refs":["reading.tfng.semantic-relation"],"confidence":0.55,"supporting_evidence":["evt-006"],"contradicting_evidence":["evt-007","evt-010"],"created_at":"2026-08-20T08:00:00Z","last_updated_at":"2026-08-26T04:02:00Z","status":"weakened","next_test":"Run a delayed contrastive TFNG transfer after at least 24 hours.","producer":"Codex","producer_version":"gpt-5"}
